{
  "include_output_preview": false,
  "limits": {
    "cpus": 0.5,
    "memory_mb": 128,
    "output_bytes": 65536,
    "pids": 64,
    "timeout_seconds": 15
  },
  "schema_version": "reproduction-plan-v1",
  "steps": [
    {
      "argv": [
        "/bin/sh",
        "tests/reproduce.sh"
      ],
      "cwd": ".",
      "expect": {
        "exit_code": 23,
        "stdout_contains": "LUMI_TRACE_WITNESS:path-traversal"
      }
    }
  ]
}
